{"$id":"https://outerheavenx.github.io/citadel-of-vesper/schemas/merchant.schema.json","$schema":"https://json-schema.org/draft/2020-12/schema","additionalProperties":false,"description":"Merchant (shopkeeper) definition: priced stock with flag-gated unlocks.","properties":{"flavor":{"type":"string"},"id":{"pattern":"^[a-z0-9_]+$","type":"string"},"name":{"type":"string"},"priceMult":{"minimum":0.1,"type":"number"},"roomId":{"pattern":"^[a-z0-9_]+$","type":"string"},"stock":{"items":{"additionalProperties":false,"properties":{"itemId":{"pattern":"^[a-z0-9_]+$","type":"string"},"note":{"type":"string"},"priceMult":{"minimum":0.1,"type":"number"},"quantity":{"description":"Remaining units for sale; null = unlimited restocking goods.","minimum":1,"type":["integer","null"]},"requiresFlag":{"description":"GameState flag that must be truthy for this line to appear.","type":"string"}},"required":["itemId"],"type":"object"},"minItems":1,"type":"array"},"title":{"type":"string"}},"required":["id","name","title","roomId","flavor","stock"],"title":"Merchant","type":"object"}