[{"flavor":"Provisioner of the Hollow Keep. Her shelves survived the Ruin; her prices did not.","id":"wren_aldervale","name":"Wren Aldervale","priceMult":1.0,"roomId":"hollow_keep_002","stock":[{"itemId":"ember_tonic","quantity":null},{"itemId":"vesper_draught","quantity":null},{"itemId":"ashward_draught","quantity":null},{"itemId":"wayfarer_coat","quantity":null},{"itemId":"dusk_hood","quantity":2},{"itemId":"iron_signet","quantity":1},{"itemId":"moonsteel_sabre","priceMult":1.0,"quantity":1,"requiresFlag":"boss_defeated_chapel_warden"}],"title":"Provisioner of the Hollow Keep"},{"flavor":"A peddler who walks the Moonlit Gate with a pack full of other people's bad decisions.","id":"corvus_vane","name":"Corvus Vane","priceMult":1.15,"roomId":"moonlit_gate_002","stock":[{"itemId":"ember_tonic","quantity":null},{"itemId":"vesper_draught","quantity":null},{"itemId":"ashward_draught","quantity":3},{"itemId":"wayfarer_coat","quantity":null},{"itemId":"moonstone_charm","quantity":1,"requiresFlag":"boss_defeated_chapel_warden"}],"title":"Moonlit Gate Peddler"}]